{
    "$schema": "https://zhibeigg.github.io/Orryx/kether/contracts/channel-manifest-v1.schema.json",
    "formatVersion": 1,
    "channel": "stable",
    "releaseId": "Orryx@2.44.115+10199c35bb35af279eb74775179bf476a51a504b",
    "pluginVersion": "2.44.115",
    "commit": "10199c35bb35af279eb74775179bf476a51a504b",
    "publishedAt": "2026-07-13T14:13:14Z",
    "releaseManifest": "/Orryx/kether/releases/2.44.115/10199c35bb35af279eb74775179bf476a51a504b/manifest.json"
}
